{
  "$schema": "schema/mobiloop.config.schema.json",
  "securityMode": "trusted",
  "workspaceRoot": ".",
  "artifactsDir": ".mobiloop",
  "runId": "local-login-smoke",
  "maxCommandMs": 120000,
  "maxOutputBytes": 1048576,
  "maxFixAttempts": 3,
  "maxTestIterations": 5,
  "maxRuntimeMinutes": 30,
  "allowedBranchPattern": "^feature/ai-[A-Za-z0-9._/-]+$",
  "appiumServerUrl": "http://127.0.0.1:4723",
  "adbPath": "adb",
  "emulatorPath": "emulator",
  "xcrunPath": "xcrun",
  "xcodebuildPath": "xcodebuild",
  "sqlitePath": "sqlite3",
  "apiAllowlist": ["http://127.0.0.1:*", "http://localhost:*", "https://staging.example.com"],
  "appiumAllowlist": ["http://127.0.0.1:*", "http://localhost:*"],
  "requireApproval": true,
  "redactArtifacts": true,
  "forbiddenPathGlobs": [
    ".env",
    ".env.*",
    "**/.env",
    "**/.env.*",
    "**/*.keystore",
    "**/*.jks",
    "**/*.p12",
    "**/*.mobileprovision",
    "**/GoogleService-Info.plist",
    "**/google-services.json",
    "**/*secret*",
    "**/*credential*"
  ],
  "toolPolicies": {
    "code.apply_patch": {
      "requiresApproval": true,
      "riskLevel": "write"
    },
    "device.clear_app_data": {
      "requiresApproval": true,
      "riskLevel": "dangerous"
    },
    "build.install_dependencies": {
      "requiresApproval": true,
      "riskLevel": "network"
    }
  }
}
